Comments,Engagement rate,Image,Likes,Url,Date,Caption
1,0.5481454412570802%,https://instagram.fcgk18-1.fna.fbcdn.net/v/t51.2885-15/e35/s1080x1080/88408533_149107562936185_1283666722149857013_n.jpg?_nc_ht=instagram.fcgk18-1.fna.fbcdn.net&_nc_cat=101&_nc_ohc=Dc9u98nB8A0AX8eKtMP&oh=658e43a748e36cffbff895220b9f76d8&oe=5EE16783,89,https://www.instagram.com/p/B9YrEGwA6DM,Fri Mar 06 15:29:22 WIB 2020,"Miniapolis General Cleaning ✨-Demi menjaga kenyamanan si kecil dan orang tua, ini yang selalu kami lakukan setiap hari sebelum dan sesudah jam operational berlangsung. Kebersihan, Keamanan dan Hospitality adalah 3 pilar Miniapolis untuk tetap menjaga playground kami tetap nyaman dikunjungi. Here's a little sneak peek bagaimana kami menjaga kebersihan di area Miniapolis 🐰-#miniapolis #miniapolisplayground"
0,0.17662464218283694%,https://instagram.fcgk18-1.fna.fbcdn.net/v/t51.2885-15/e35/s1080x1080/87581738_214767156380301_9088428293510176276_n.jpg?_nc_ht=instagram.fcgk18-1.fna.fbcdn.net&_nc_cat=109&_nc_ohc=pjft9ceR8fAAX86pGI3&oh=46ce7ec2ab6f963ccefbd74c1b26f992&oe=5EE277F8,29,https://www.instagram.com/p/B9Vn6SmgE27,Thu Mar 05 11:04:05 WIB 2020,"Playhouse at Miniapolis Lippo Mall Puri-Yeay! Weekend tinggal dua hari lagi, sudah pernah ajak si kecil bermain di Playhouse Miniapolis Lippo Mall Puri, Mom? Kalau belum, yuk minggu ini datang ke Miniapolis sambil nikmati promo international women's day, stay tune untuk tahu akan ada promo apa minggu ini di Miniapolis ya Mom. See youu 🐰-#mianiapolis #miniapolisplayground #miniapolislippomallpuri"
0,0.18880565198854984%,https://instagram.fcgk18-2.fna.fbcdn.net/v/t51.2885-15/e35/s1080x1080/88397669_2817512841649264_8180617650406209989_n.jpg?_nc_ht=instagram.fcgk18-2.fna.fbcdn.net&_nc_cat=104&_nc_ohc=lEC51jrs15YAX-OJuFs&oh=fb03ad8f2bd891dfb2be752e4e48940a&oe=5EE3A709,31,https://www.instagram.com/p/B9Q0r15Ajth,Tue Mar 03 14:19:30 WIB 2020,"Hi Mom, main bersama lagi yuk di Miniapolis.-Memasuki Bulan Maret ini, Miniapolis sudah sediakan promo Women's Day lho. Promo ini kami berikan khusus untuk Mom dan anak perempuan Mom yang nanti datang bermain ke Miniapolis di Hari Perempuan Sedunia. Kira-kira di hari tersebut, promo apa yang Mom inginkan dari Miniapolis untuk si kecil? Komen di bawah yuk...-#miniapolis #miniapolisplayground #womensday"
0,0.20707716669711917%,https://instagram.fcgk18-1.fna.fbcdn.net/v/t51.2885-15/e35/s1080x1080/87589260_672866803451857_7129062003009504391_n.jpg?_nc_ht=instagram.fcgk18-1.fna.fbcdn.net&_nc_cat=101&_nc_ohc=imMO6GAYmQcAX949O5T&oh=2436f827600a8eace0befb7514ef6fb8&oe=5EE2990C,34,https://www.instagram.com/p/B8--oTIAhgI,Tue Feb 25 16:00:04 WIB 2020,"Yeay Pay Day! It's time to Crick's Bazaar!Hi Moms! Weekend ini akan ada bazaar lagi lho di Miniapolis Plaza Indonesia, jangan sampai ketinggalan ya. Tersedia beberapa booth Ibu dan anak yang sudah ready dengan promo menarik untuk kebutuhan si kecil (swipe untuk tahu ada booth apa saja yang nanti akan Mom temui). Sampai bertemu Jumat ini, di Miniapolis Plaza Indonesia Lt. 3.-#miniapolis #miniapolisplayground #miniapoliscricksbazaar #bazaar #miniapolisplazaindonesia"
0,0.18880565198854984%,https://instagram.fcgk18-2.fna.fbcdn.net/v/t51.2885-15/e35/s1080x1080/85060456_1030334820675624_8498729660423821377_n.jpg?_nc_ht=instagram.fcgk18-2.fna.fbcdn.net&_nc_cat=100&_nc_ohc=0Zct8CM_VYYAX-O2bUP&oh=9f4254c9e5d4e9f5cdac77c948a59d2a&oe=5EE0BFBC,31,https://www.instagram.com/p/B8p-aLLA1k_,Mon Feb 17 12:14:06 WIB 2020,"[Miniapolis Kids Club] Yeay! Ada special class lagi Jumat ini di Miniapolis Kids Club Plaza Indonesia. Kali ini Miniapolis bekerjasama dengan @bricks4kidz.id menyajikan Lego Bricks untuk mengajak si kecil mengasah fine-motor skills, logic dan fokus. Jumat nanti kita akan bermain dengan Duplo sambil membuat pattern, menghitung, bermain warna dan hal menyenangkan lainnya yang kita lakukan bersama di Miniapolis Kids Club nanti.Yuk reservasi sekarang: 0811 1573 743 Sampai bertemu!🐰-#miniapolis #miniapolisplayground #miniapoliskidsclub #kidsclub #miniapoliskidsclubplazaindonesia"
0,0.2253486814056885%,https://instagram.fcgk18-1.fna.fbcdn.net/v/t51.2885-15/e35/84436356_489045415384311_4654585998900597223_n.jpg?_nc_ht=instagram.fcgk18-1.fna.fbcdn.net&_nc_cat=103&_nc_ohc=ClFGf7jJTykAX-GpU7r&oh=1370cdf704576f61edae9e616725a014&oe=5EE38D3F,37,https://www.instagram.com/p/B8h9c95gL3L,Fri Feb 14 09:31:49 WIB 2020,"You're all I need, My Mom, My Valentine ♥️-Selamat Hari Kasih Sayang untuk para mommy dan calon mommy yang membaca ini. Terima kasih untuk kasih sayang yang tidak pernah terhingga sampai hari ini. Seperti lirik lagu Martina McBride yang mengatakan, Until the end of time, You're all I need My Love, My Valentine. Sampai kapan pun tidak ada yang kami butuhkan selain kasih sayang Mommy dan Daddy 💌 P.S. I Love You #happyvalentinesday -#miniapolis #miniapolisplayground #bringingsmilestoeveryone"
8,0.3532492843656739%,https://instagram.fcgk18-2.fna.fbcdn.net/v/t51.2885-15/e35/s1080x1080/84321691_2017412645071554_911515615376031952_n.jpg?_nc_ht=instagram.fcgk18-2.fna.fbcdn.net&_nc_cat=106&_nc_ohc=Gw_HGS5KsCkAX_SIQjZ&oh=24247354e2dab6c20c5b7559b111f257&oe=5EE17404,50,https://www.instagram.com/p/B8fZPNHABAX,Thu Feb 13 09:36:53 WIB 2020,"Hi Moms! 🥳Yuk catat tanggalnya akan ada kegiatan apa saja di Miniapolis akhir pekan ini hingga penghujung februari nanti.-Semua kegaiatan ini gratis untuk setiap pembelian tiket All Day Pass lho Moms, jangan sampai ketinggalan untuk ajak si kecil ikuti keseruan activity hanya di Miniapolis ya... psst... kuota terbatas. See you Moms 🐰-Info lebih lanjut: 0815 1721 8566#miniapolis #miniapolisplayground #kidsactivities"
2,0.3471587794628175%,https://instagram.fcgk18-1.fna.fbcdn.net/v/t51.2885-15/e35/84176927_215771009580135_1044690931419126026_n.jpg?_nc_ht=instagram.fcgk18-1.fna.fbcdn.net&_nc_cat=103&_nc_ohc=Kqq7EcQwTuoAX8BdScD&oh=0cb1a45c96d8a15422a29756f42031b1&oe=5EE31093,55,https://www.instagram.com/p/B8aSrtDgx-L,Tue Feb 11 10:03:24 WIB 2020,"Sebagai tempat bermain yang mengusung perkembangan syaraf motorik si kecil, Miniapolis menyediakan beberapa sepeda yang bisa dicoba untuk belajar melatih keseimbangan sejak dini. Salah satunya, sepeda tanpa pedal. Kini tersedia @londontaxi_kids yang dapat si kecil coba saat bermain ke Miniapolis lho Mom, tag dan mention ke kami yuk bagaimana jagonya si kecil saat mengendarai sepeda tanpa pedal ini.-#miniapolis #miniapolisplayground #londontaxibike"
0,0.24362019611425786%,https://instagram.fcgk18-2.fna.fbcdn.net/v/t51.2885-15/e35/83938155_187837332435822_3875802544149827131_n.jpg?_nc_ht=instagram.fcgk18-2.fna.fbcdn.net&_nc_cat=106&_nc_ohc=6c90_k56sCcAX9uMNzw&oh=870d43fbad7d012d236cc769ae1b4347&oe=5EE282F0,40,https://www.instagram.com/p/B8X6MGLgWYm,Mon Feb 10 11:50:53 WIB 2020,"Choco bath, bubble bath atau baby swim? Mana yang paling disukai si kecil saat ke Miniapolis Baby Spa by @momnjo, Mom? Jangan lupa untuk mencoba treatment massage si kecil dengan therapist kami saat datang nanti ya Mom, ada treatment untuk Mom juga lho, jadi bisa Spa bersama di Miniapolis Baby Spa.-Miniapolis Baby Spa saat ini tersedia di:Plaza Indonesia: 0811 8080 207 (JKT)Lippo Mall Puri: 0811 1710 205 (JKT)23 Paskal: 0818 09107 042 (BDG)Pakuwon Mall : 0811 8080 209 (SBY)-#miniapolis #miniapolisplayground #miniapolisbabyspabymomnjo #momnjo #babyspa"
0,0.12181009805712893%,https://instagram.fcgk18-2.fna.fbcdn.net/v/t51.2885-15/e35/s1080x1080/83461215_217644579410058_6967050634705352887_n.jpg?_nc_ht=instagram.fcgk18-2.fna.fbcdn.net&_nc_cat=106&_nc_ohc=IJyoVJKUWhsAX_ANRkV&oh=88cd4c33adbdc4e4cb0e15363b179811&oe=5EE37CB9,20,https://www.instagram.com/p/B8V1vV2gm2b,Sun Feb 09 16:33:32 WIB 2020,"Hi Moms! Yuk ajak si kecil rayakan Hari Valentine nanti di Minipolis Kids Club Plaza Indonesia sambil memainkan nada cinta untuk Mom.-Special music class by Miniapolis x @maestrointraining berkolaborasi memberikan pengalaman mini orchestra kepada si kecil. Dari beberapa alat musik seperti harpa, gitar, biola, dsb, kita akan ajak si kecil bernyanyi, menari dan belajar nada bersama untuk membuat mereka terbiasa dengan melodi dan alunan dari para Play Leader yang dikemas dalam konsep kelas musik yang pas dengan usianya.-Limited Seats for 20 Kids only!Book Now: 0811 1573 743-#miniapolis #miniapolisplayground #miniapoliskidsclub #miniapoliskidsclubplazaindonesia #musicclass"
0,0.14617211766855473%,https://instagram.fcgk18-2.fna.fbcdn.net/v/t51.2885-15/e35/83021115_242620020062227_4654702228911837392_n.jpg?_nc_ht=instagram.fcgk18-2.fna.fbcdn.net&_nc_cat=107&_nc_ohc=pdO5und9DFkAX-kIR6_&oh=2bdff561ae31bd8d2bd3265f096ae461&oe=5EE21FC8,24,https://www.instagram.com/p/B8NnCCigY02,Thu Feb 06 11:51:05 WIB 2020,"Miniapolis Kids Club (MKC) - Kids Fun Class from Monday to Friday at Miniapolis 🖍-Bermain dan berkegiatan bersama Play Leader (Teacher) di Miniapolis Kids Club. Setiap Jumat, MKC menyediakan kelas khusus dengan kegiatan yang lebih seru untuk diikuti Mom dan si kecil. Sudah pernah join Mom? Kami tunggu reviewnya yaaa...-Info lebih lanjut: 0811 1573 743#miniapolis #miniapolisplayground #miniapoliskidsclub"
3,0.2618917108228272%,https://instagram.fcgk18-2.fna.fbcdn.net/v/t51.2885-15/e35/82739935_1042137799518883_8038314020949372352_n.jpg?_nc_ht=instagram.fcgk18-2.fna.fbcdn.net&_nc_cat=107&_nc_ohc=CHIY3PyHJSoAX_nYXAJ&oh=3218fb78104f320f91cc2767d5b234e7&oe=5EE32144,40,https://www.instagram.com/p/B8GAAOcAwBx,Mon Feb 03 12:55:22 WIB 2020,"Last Friday at Miniapolis Kids Club (MKC) Plaza Indonesia 🖍-Di Art Class Jumat lalu, Miniapolis kedatangan kakak-kakak dari @kalart.id untuk mengajak murid MKC membuat prakarya 'Mouse Lucky Year Pouch'. Senang sekali di sini kami belajar mengenal bentuk, menempel dan menggunakan hasilnya sebagai tas yang bisa dibawa pulang. Tunggu keseruan kami di kelas lainnya yaa Moms.-Info lebih lanjut: 0811 1573 743-#miniapolis #miniapolisplayground #miniapoliskidsclub #miniapoliskidsclubplazaindonesia"
0,0.1705341372799805%,https://instagram.fcgk18-1.fna.fbcdn.net/v/t51.2885-15/e35/s1080x1080/82374172_2400530820046479_3334039286002828749_n.jpg?_nc_ht=instagram.fcgk18-1.fna.fbcdn.net&_nc_cat=103&_nc_ohc=WLqD7Ga2wcgAX9WF3AF&oh=bb039d1f6aea7d05c4051b5203a6e276&oe=5EE22A87,28,https://www.instagram.com/p/B740J5lALum,Wed Jan 29 10:01:42 WIB 2020,"Miniapolis Kids Club x @iengineer.id -Jangan lupa daftarkan si kecil untuk Miniapolis Kids Club Lippo Mall Puri Jumat, 07 Februari nanti. Di sini kami akan ajak si kecil bernyanyi, mendongeng, hingga mini experimen. Salain kegiatan tersebut, harga sudah termasuk tiket bermain All Day Pass Miniapolis dan goodie bag menarik lho Moms, jangan sampai ketinggalan ya.Pendaftaran: 0811 1573 743-#miniapolis #miniapolisplayground #miniapoliskidsclub #activityforkids"
0,0.231439186308545%,https://instagram.fcgk18-2.fna.fbcdn.net/v/t51.2885-15/e35/s1080x1080/83316228_3303340729692302_1759328093820072290_n.jpg?_nc_ht=instagram.fcgk18-2.fna.fbcdn.net&_nc_cat=102&_nc_ohc=nUpDbWG_3IUAX82Dy_R&oh=73b688fd1befbda281083c97a3a34a77&oe=5EE1DA32,38,https://www.instagram.com/p/B7uiyQngGEN,Sat Jan 25 10:17:31 WIB 2020,"Happy Lunar New Year 🧧Wishing you good fortune on this rat year, may our family be blessed.-P.s. Grab it fast, Miniapolis Lunar New Year red envelopes, for every purchase of All Day Pass (ADP) ticket."
0,0.1157195931542725%,https://instagram.fcgk18-1.fna.fbcdn.net/v/t51.2885-15/e35/s1080x1080/81796001_315197126090051_1848431027758477975_n.jpg?_nc_ht=instagram.fcgk18-1.fna.fbcdn.net&_nc_cat=111&_nc_ohc=OixFwf-kAlMAX8Ayfuc&oh=f384f8e760af82199ae1b82ae1c0dafc&oe=5EE2DBE5,19,https://www.instagram.com/p/B7hrghpAT-q,Mon Jan 20 10:23:37 WIB 2020,"Miniapolis Kids Club x @kalart.id -Friday - Art Day! Yuk Moms, ajak si kecil ke Miniapolis Kids Club Plaza Indonesia Jumat, 31 Januari untuk melakukan kreativitas bersama, akan dipandu langsung oleh tim dari Kāla Art Studio. Salain membuat prakarya, harga sudah termasuk tiket bermain All Day Pass Miniapolis dan goodie bag menarik lho Moms, jangan sampai ketinggalan ya.Pendaftaran: 0811 1573 743-#miniapolis #miniapolisplayground #miniapoliskidsclub #activityforkids"
0,0.2253486814056885%,https://instagram.fcgk18-2.fna.fbcdn.net/v/t51.2885-15/e35/80854874_611697619565440_7187395135845835538_n.jpg?_nc_ht=instagram.fcgk18-2.fna.fbcdn.net&_nc_cat=104&_nc_ohc=cQLgIdw6UxgAX94HNyt&oh=da2ca0dd0938a314f72a52c9765c2892&oe=5EE2248A,37,https://www.instagram.com/p/B7cawGMgH5v,Sat Jan 18 09:21:00 WIB 2020,"Happy weekend, dear Moms! Waktunya si kecil untuk rehat sejenak dari aktifitasnya selama satu minggu sebelum memulai Senin yang akan datang lagi, nih. Selain bermain ke playground, biasanya Mom senang ajak si kecil menghabiskan akhir pekannya dengan cara apa? Share di kolom komentar yuk...#miniapolis #miniapolisplayground #weekendtime #weekendfun"
0,0.20707716669711917%,https://instagram.fcgk18-2.fna.fbcdn.net/v/t51.2885-15/e35/81038020_170802767658439_4222386596757814689_n.jpg?_nc_ht=instagram.fcgk18-2.fna.fbcdn.net&_nc_cat=107&_nc_ohc=iHgjJfw5Bz8AX9zAGNp&oh=06906175767d2da5097b8f59d2e904a9&oe=5EE15080,34,https://www.instagram.com/p/B7XXCkmgL0O,Thu Jan 16 10:12:22 WIB 2020,"Happy Thursday Everyone!Si kecil senang membaca atau bermain LEGO? Miniapolis 23 Paskal menyediakan spot untuk hal tersebut lho Moms. Uniknya, tempat ini dibuat seperti rumah pohon dengan tangga dan bisa melihat area playground dari atas. Ada yang sudah pernah ajak si kecil bermain di area ini? Yuk tag dan mention kami 🐰#miniapolis #miniapolisplayground #miniapolis23paskal"
0,0.24362019611425786%,https://instagram.fcgk18-2.fna.fbcdn.net/v/t51.2885-15/e35/80434783_1458585254310696_7071552713134699537_n.jpg?_nc_ht=instagram.fcgk18-2.fna.fbcdn.net&_nc_cat=100&_nc_ohc=3sQr754YzC4AX_BkRt7&oh=927c467bbb774c6ce847015ddf9386b6&oe=5EE2BE7F,40,https://www.instagram.com/p/B7C4yzrg8jB,Wed Jan 08 11:23:15 WIB 2020,"Chinese New Year Bazaar!Hi Moms! Weekend ini akan ada Miniapolis Chinese New Year Bazaar lho, jangan sampai ketinggalan ya. Karena, beberapa booth Ibu dan anak sudah ready dengan promo menarik untuk kebutuhan si kecil. Sampai bertemu Jumat ini, di Miniapolis Plaza Indonesia Lt. 3.-#miniapolis #miniapolisplayground #miniapolischinesenewyearbazaar #bazaar #miniapolisplazaindonesia"
0,0.38370180887995614%,https://instagram.fcgk18-1.fna.fbcdn.net/v/t51.2885-15/e35/80657124_2462265280768433_5992205790634854049_n.jpg?_nc_ht=instagram.fcgk18-1.fna.fbcdn.net&_nc_cat=105&_nc_ohc=weMDYOHbRlQAX9v-P4u&oh=7a8e02ddc0676c7b8bae2400693c32fa&oe=5EE0F325,63,https://www.instagram.com/p/B7ATPJ-Ae6X,Tue Jan 07 11:16:36 WIB 2020,"Miniapolis Mini Zoo - Miniapolis 23 Paskal, Bandung-Salah satu cabang Miniapolis yang  memberikan pengalaman lebih dari sekadar taman bermain, tersedia Mini Zoo. Tempat di mana si kecil bisa berinteraksi langsung dengan hewan-hewan untuk memberi makan, mengelilingi mini zoo dengan kereta kuda atau domba atau sekedar bermain dengan burung maupun anak ayam. Yuk ke Miniapolis 23 Paskal, Bandung Mom...-#miniapolis #miniapolisplayground #miniapolis23paskal #bandung"
0,0.20098666179426275%,https://instagram.fcgk18-1.fna.fbcdn.net/v/t51.2885-15/e35/81193071_3347590311980185_8313852880066870879_n.jpg?_nc_ht=instagram.fcgk18-1.fna.fbcdn.net&_nc_cat=101&_nc_ohc=UOPADOPfUYYAX9ScHKz&oh=fb1f2a0fad8ddf363bb3b22be3b3d984&oe=5EE0C75B,33,https://www.instagram.com/p/B67OcegAvHl,Sun Jan 05 11:58:31 WIB 2020,"DigiWall Climbing WallAda wahana baru lho di Miniapolis 23 Paskal Bandung, DigiWall. Permainan ini akan mengajak si kecil melakukan kegiatan fisik - body movement sesuai dengan tombol led merah yang menyala untuk diburu untuk ditekan nantinya. Dengan irama musik dan waktu satu menit, DigiWall dapat menghitung berapa banyak tombol merah yang berhasil si kecil raih. Saat tidak digunakan, DigiWall juga menjadi instalasi dengan irama dan lampu-lampu yang menyala sesuai ritme. Ajak si kecil untuk mencoba yuk Mom, jangan lupa tag/mention kami ya 🐰-#miniapolis #miniapolisplayground #miniapolis23paskal"
3,0.2558012059199708%,https://instagram.fcgk18-1.fna.fbcdn.net/v/t51.2885-15/e35/s1080x1080/80900697_489332618384613_1072931176913459547_n.jpg?_nc_ht=instagram.fcgk18-1.fna.fbcdn.net&_nc_cat=109&_nc_ohc=ptGvJro9KDEAX8x2BT6&oh=78bdb7c295f58ca38b02924c22401979&oe=5EE06FB3,39,https://www.instagram.com/p/B6wucZLAcEl,Wed Jan 01 10:06:29 WIB 2020,"Happy New Year! May this new year be the happiest and the best of all years for your Family. Regards,Miniapolis team 2020 🥳-#miniapolis #miniapolisplayground #happynewyear2020"
0,0.26798221572568365%,https://instagram.fcgk18-2.fna.fbcdn.net/v/t51.2885-15/e35/80048248_2888349387939550_3392462377537544882_n.jpg?_nc_ht=instagram.fcgk18-2.fna.fbcdn.net&_nc_cat=110&_nc_ohc=SNXYKtbBF2IAX-GY20O&oh=f7ed0c7e0300d001ca94935806ae0fd1&oe=5EE1FF4F,44,https://www.instagram.com/p/B6ryWIAA5nb,Mon Dec 30 12:04:23 WIB 2019,"Ke Miniapolis sambil mengisi liburan? It's a Big Yes!-Di musim liburan seperti ini, Miniapolis juga tetap bisa menjadi pilihan lho Moms, tidak hanya bermain, tetapi juga si kecil akan diajak mengasah motorik dan sensoriknya, tentunya harus tetap didampingi yaa. Moms yang berlibur ke Bandung atau Surabaya juga masih bisa bertemu Miniapolis lho, jangan lupa, Miniapolis juga tersedia di 23 Paskal Bandung dan Pakuwon Mall Surabaya. Jika mampir nanti, jangan lupa tag dan mention kami ya Moms, happy holiday! -#miniapolis #miniapolisplayground #liburankeminiapolis"
6,0.3593397892685304%,https://instagram.fcgk18-1.fna.fbcdn.net/v/t51.2885-15/e35/76856342_184974482965273_5941347575022091535_n.jpg?_nc_ht=instagram.fcgk18-1.fna.fbcdn.net&_nc_cat=101&_nc_ohc=YN1ooDQTkiQAX-50070&oh=5009eae6fce98fbbdab0c1d82b132b43&oe=5EE370CB,53,https://www.instagram.com/p/B6kB8HRAiWV,Fri Dec 27 11:46:43 WIB 2019,"Hi Moms! Bagaimana liburannya dengan si kecil?-Senang sekali kami dapat kiriman dari salah satu mommy yang beberapa waktu lalu berkunjung ke Miniapolis 23 Paskal Bandung, saat si kecil sedang bermain di area Mini Zoo bersama kelinci. Share juga yuk liburan Mom dengan si kecil saat ke Miniapolis, cabang mana yang Mom suka atau kunjungi di liburan kali ini?🐰-#miniapolis #miniapolisplayground #miniapolis23paskal #miniapolisminizoo"
1,0.2618917108228272%,https://instagram.fcgk18-2.fna.fbcdn.net/v/t51.2885-15/e35/77018486_160524238646556_7529165721643672805_n.jpg?_nc_ht=instagram.fcgk18-2.fna.fbcdn.net&_nc_cat=100&_nc_ohc=AeY7tq8OB0cAX83lCW2&oh=2ac2465c8532f65cf5d2447868cbcb46&oe=5EE0E0B9,42,https://www.instagram.com/p/B6W3YSQgvjY,Sun Dec 22 09:04:19 WIB 2019,"Enjoy your Day, Moms! ♥️-Cinta yang tidak akan pernah berhenti diberikan dari seorang wanita, wujud dari malaikat yang dikirim Tuhan untuk kuat, untuk selalu mengajarkan mencintai diri sendiri dan percaya kalau kami, bisa! -Selamat hari Ibu untuk para mommy hebat yang membaca ini, kami percaya bahwa kesuksesan kami hari ini, tak lepas dari doa dan ajaranmu. Terima kasih untuk segala cintanya ❤️#miniapolis #miniapolisplayground #selamathariibu"
3,0.2618917108228272%,https://instagram.fcgk18-2.fna.fbcdn.net/v/t51.2885-15/e35/75272061_179714753081702_5963250639234045739_n.jpg?_nc_ht=instagram.fcgk18-2.fna.fbcdn.net&_nc_cat=102&_nc_ohc=qWAaxdhtaJwAX8p76Fh&oh=61932fe689facd243113a49517b04910&oe=5EE06044,40,https://www.instagram.com/p/B5sZOE4gxd3,Thu Dec 05 21:12:40 WIB 2019,"The last bazaar of the year! 🎄-Hi Moms, besok hingga Minggu Miniapolis Holiday Bazaar hadir kembali untuk mengajak moms menemukan kebutuhan si kecil untuk persiapannya di tahun depan. Mulai dari mainan, pakaian, sepatu, sekolah, hingga pernak-pernik lucu tersedia dari 6-8 Desember 2019 hanya di Miniapolis Holiday Bazaar, Miniapolis Plaza Indonesia Lt. 3-#miniapolis #miniapolisplayground #miniapolisholidaybazaar"
1,0.3349777696571046%,https://instagram.fcgk18-2.fna.fbcdn.net/v/t51.2885-15/e35/76992411_763401117487554_223043789816011067_n.jpg?_nc_ht=instagram.fcgk18-2.fna.fbcdn.net&_nc_cat=106&_nc_ohc=9AvXMPLEifYAX8yRlNc&oh=44264b8675ac1156405b92b311d1edfd&oe=5EE257D5,54,https://www.instagram.com/p/B5rqfcTAVfQ,Thu Dec 05 14:24:21 WIB 2019,"Mini Orchestra with @maestrointraining 🎶-Hi Moms, masih ingat music class minggu lalu di Miniapolis Kids Club Lippo Mall Puri? Terima kasih sudah ajak si kecil bersenang-senang memainkan alat musik dan bernyanyi bersama di Miniapolis. Kira-kira, nextnya di Miniapolis Kids Club, yang seru kita buat kelas apa dan bersama siapa ya Mom? Mention di bawah ya...-#miniapolis #miniapolisplayground #miniapolislippomallpuri"
2,0.28016322553139655%,https://instagram.fcgk18-1.fna.fbcdn.net/v/t51.2885-15/e35/s1080x1080/72215455_165688987827101_2609533901152478605_n.jpg?_nc_ht=instagram.fcgk18-1.fna.fbcdn.net&_nc_cat=105&_nc_ohc=TvNm_LmIRY0AX8In1VB&oh=1aeb424d857f56eb4600e3358ed226df&oe=5EE29684,44,https://www.instagram.com/p/B5otWPRApSr,Wed Dec 04 10:51:35 WIB 2019,"Di laut tahun 2050 nanti, akan lebih banyak plastik daripada ikan.-Wah ternyata 'Laut Kita' sudah makin terancam untuk kehidupan generasi anak kita nanti Moms. Sebagai orang tua yuk mulai biasakan si kecil sejak dini untuk lebih sadar akan hidup ramah lingkungan demi habitat yang layak demi #sustainablefuture♻️ -Cari informasi lebih lanjut di @sejauh_mata_memandang atau ajak si kecil datang langsung ke Pameran Laut Kita di Senayan City Jakarta yang tersedia hingga  02 February 2020.-#miniapolis #miniapolisplayground #miniapolisxsejauhmatamemandang #sejauhmatamemandang #sejauhmanakamupeduli #sejauhlautkita #sejauhlautkitamasadepankita"
1,0.2253486814056885%,https://instagram.fcgk18-1.fna.fbcdn.net/v/t51.2885-15/e35/74715140_2343775369267105_7612966881817988810_n.jpg?_nc_ht=instagram.fcgk18-1.fna.fbcdn.net&_nc_cat=101&_nc_ohc=Hj4EFDcBuCsAX8Lz-A-&oh=5fbdc43e658bcccc47da2819f01ed990&oe=5EE4140F,36,https://www.instagram.com/p/B5m8nF7Au4J,Tue Dec 03 18:26:29 WIB 2019,"Wohoooo... it's holiday season! Weekend ini ke Miniapolis yuk Mom karena sudah kami siapkan beberapa aktivitas menarik yang dapat diikuti si kecil. Yuk carat tanggalnya dan kegiatan di cabang Miniapolis mana yang ingin Mom datangi minggu ini. See you! RSVP: 0815 1721 8566#miniapolis #miniapolisplayground"
0,0.05481454412570802%,https://instagram.fcgk18-2.fna.fbcdn.net/v/t51.2885-15/e35/71970340_160099042044158_1934239210377742394_n.jpg?_nc_ht=instagram.fcgk18-2.fna.fbcdn.net&_nc_cat=102&_nc_ohc=iVWJfqXEsToAX-ZiNHe&oh=7a6eebf60ec6768ba23745ab2f43ca92&oe=5EE33AD9,9,https://www.instagram.com/p/B5gtkoxA4KA,Sun Dec 01 08:19:38 WIB 2019,"Hi Moms yang di Bandung,Kalau hari ini bingung mau kemana, yuk ajak si kecil ikuti kelas memasak di Miniapolis Holiday Bazaar, 23 Paskal.Miniapolis bekerjasama dengan @mamage_kitchen untuk ajak si kecil menjadi koki kecil hari ini. Sampai jumpa siang ini ya Mom 🐰- #miniapolis #miniapolisplayground #miniapolisholidaybazaar"
0,0.1583531274742676%,https://instagram.fcgk18-2.fna.fbcdn.net/v/t51.2885-15/e35/75324278_566543987411563_5671075836353743253_n.jpg?_nc_ht=instagram.fcgk18-2.fna.fbcdn.net&_nc_cat=107&_nc_ohc=9D4ycExo0jgAX_26qeL&oh=753b264663135e75e1968023153cb781&oe=5EE23B7C,26,https://www.instagram.com/p/B5flK_NAgK4,Sat Nov 30 21:46:59 WIB 2019,"Holla Bandung!Weekend ini masih ada Miniapolis Holiday Bazaar lho, jangan sampai ketinggalan ya. Karena, beberapa booth Ibu dan anak sudah ready dengan beberapa promo untuk kebutuhan si kecil. Sampai bertemu besok di Miniapolis 23 Paskal, Bandung Lt.3.-#miniapolis #miniapolisplayground #miniapolisholidaybazaar"
2,0.3532492843656739%,https://instagram.fcgk18-1.fna.fbcdn.net/v/t51.2885-15/e35/75439589_130471238377655_6665583426190443734_n.jpg?_nc_ht=instagram.fcgk18-1.fna.fbcdn.net&_nc_cat=111&_nc_ohc=ld58v7mJa_sAX8MWCgs&oh=3e5cf8de09fb3f063a570295b7cd48bb&oe=5EE15C4A,56,https://www.instagram.com/p/B5VHwivA_Ap,Tue Nov 26 20:17:33 WIB 2019,"Fun Science Class 🔬-Hooraaay! It's a wrap! Ada yang berbeda di Science Class Miniapolis Kids Club Plaza Indonesia minggu lalu. Ditemani Teacher Miniapolis Kids Club dan Mentor dari @magicscience_id kami hadirkan konsep kelas yang menyenangkan dan edukatif untuk si kecil. Nah, tertarik untuk intip keseruan lainnya di Miniapolis Kids Club? Atau bagaimana cara bergabung di Miniapolis Kids Club?Yuk hubungi kami: 0811 1573 743-#miniapolis #miniapoliskidsclub #miniapoliskidsclubplazaindonesia #scienceclassforkids #miniapolisplayground"
2,0.286253730434253%,https://instagram.fcgk18-2.fna.fbcdn.net/v/t51.2885-15/e35/s1080x1080/72254151_215639436094744_9057680565633991759_n.jpg?_nc_ht=instagram.fcgk18-2.fna.fbcdn.net&_nc_cat=104&_nc_ohc=gI8G4HnIsVQAX801aBa&oh=99df3cc9556220c14ae501517c1ab484&oe=5EE3945D,45,https://www.instagram.com/p/B5CoXspgOic,Tue Nov 19 15:56:57 WIB 2019,"[Miniapolis Kids Club]Hi Moms! Si kecil punya passion di bidang Musik?-Yuk ajak mereka salurkan bakatnya di Miniapolis Kids Club Lippo Mall Puri!Special music class by Miniapolis x @maestrointraining berkolaborasi memberikan pengalaman mini orchestra kepada si kecil. Dari beberapa alat musik seperti harpa, gitar, biola, dsb, kita akan ajak si kecil bernyanyi, menari dan belajar nada bersama untuk membuat mereka terbiasa dengan melodi dan alunan dari para Play Leader yang di kemas dalam konsep kelas musik yang pas dengan usianya.-Limited Seats for 25 Kids only!Book Now: 0811 1573 743-#miniapolis #miniapolisplayground #miniapoliskidsclub #miniapoliskidsclublippomallpuri #musicclass"
