Comments,Engagement rate,Image,Likes,Url,Date,Caption
0,0.2740727206285401%,https://instagram.fcgk18-2.fna.fbcdn.net/v/t51.2885-15/e35/70644279_148889999795286_3568529406123502581_n.jpg?_nc_ht=instagram.fcgk18-2.fna.fbcdn.net&_nc_cat=106&_nc_ohc=L8ymhkAey1EAX_hfyFi&oh=dfdc2384ad3d4ccb923147b73796685a&oe=5EE3DF27,45,https://www.instagram.com/p/B5CIXSWAsME,Tue Nov 19 11:17:17 WIB 2019,"LETTER FOR CRICK🐰-Dalam perayaan satu dekade ini, Miniapolis mengajak Moms dan si kecil untuk mengirimkan surat kepada maskot kami, Crick. Harapan atau kenangan tak terlupakan yang dimiliki selama 10 tahun ini, silahkan dituliskan langsung dengan datang ke Miniapolis cabang mana saja. Ada free cookies Crick juga setelah Moms dan si kecil memasukkan surat ke kotak Miniapolis lho. Jadi, sudah tuliskan keinginan si kecil kepada Crick, Moms? Jangan lupa juga untuk tuliskan akun Instagram atau tag kami ya 🐰-#miniapolis #miniapolisplayground #miniapolissatudekade"
0,0.17662464218283694%,https://instagram.fcgk18-1.fna.fbcdn.net/v/t51.2885-15/e35/75252626_536233563828771_3836467031593659680_n.jpg?_nc_ht=instagram.fcgk18-1.fna.fbcdn.net&_nc_cat=103&_nc_ohc=xq7GpjQ9IhAAX9-6D0u&oh=1ca11137312d9eca24a074bc8d67df48&oe=5EE28C2F,29,https://www.instagram.com/p/B5AJZ8sgHxd,Mon Nov 18 16:47:54 WIB 2019,"Masih dalam keseruan promo anniversary Miniapolis Satu Dekade 🐰-Mulai hari ini hingga akhir bulan, dapatkan promo Miniapolis Baby Spa by @momnjo di antaranya:- Free Treatment- Produk Belli to Baby*dengan minimum pembelanjaan Rp3jt-Jangan lewatkan promonya ya Mom, karena hanya sampai 30 November ini.#MiniapolisSatuDekade"
2,0.24971070101711432%,https://instagram.fcgk18-1.fna.fbcdn.net/v/t51.2885-15/e35/72688366_209747800055055_5914729189086882357_n.jpg?_nc_ht=instagram.fcgk18-1.fna.fbcdn.net&_nc_cat=103&_nc_ohc=jWPveL1VuhgAX87hP3A&oh=5c2d65431e678363268cabf960d53a62&oe=5EE1E1CB,39,https://www.instagram.com/p/B4_82Lrg1vD,Mon Nov 18 14:58:09 WIB 2019,"[Miniapolis Kids Club] Ada special class hari Jumat minggu ini di Miniapolis Kids Club Plaza Indonesia lho Moms. Kali ini Miniapolis bekerjasama dengan @magicscience_id menyajikan fun science class untuk si kecil. Di sini, kita akan belajar sambil bermain dan mengenal proses mencair, menguap, menyublim dari benda padat, cair mau pun gas dengan membuat berbagai percobaan Dry Ice bersama. Yuk reservasi sekarang: 0811 1573 743 Kuota terbatas ya Moms jadi jangan lupa reservasi dan ajak si kecil bermain sambil belajar hanya di Miniapolis Kids Club 🐰-#miniapolis #miniapolisplayground #miniapoliskidsclub #kidsclub #scienceclub #miniapoliskidsclubplazaindonesia"
3,0.231439186308545%,https://instagram.fcgk18-1.fna.fbcdn.net/v/t51.2885-15/e35/71137310_2474032989504159_5913571776967589396_n.jpg?_nc_ht=instagram.fcgk18-1.fna.fbcdn.net&_nc_cat=103&_nc_ohc=wrxuMxtsw7oAX_D9syT&oh=faa3199bbf61a525d87ccd61ae0858af&oe=5EE34A77,35,https://www.instagram.com/p/B44c9B3gEDb,Fri Nov 15 17:04:47 WIB 2019,"Hi Moms! Besok sudah weekend ya rupayanya. Bagaimana aktivitas si kecil satu minggu kemarin? Apa saja perkembangan yang sudah dilakukan?Seperti di Miniapolis Kids Club, tersedia fun activity untuk si kecil dari 6 bulan hingga 5 tahun bersama Play Leader dengan kegiatan di kelas yang berbeda di setiap harinya (Senin-Jumat) Dari mulai music class, art hingga cooking class. Sudah ajak si kecil ikut Miniapolis Kids Club, Mom?-Info lebih lanjut: 0811 1573 743#miniapolis #miniapolisplayground #miniapoliskidsclub"
29,0.92575674523418%,https://instagram.fcgk18-2.fna.fbcdn.net/v/t51.2885-15/e35/s1080x1080/74600013_151280409571166_2489507399841513166_n.jpg?_nc_ht=instagram.fcgk18-2.fna.fbcdn.net&_nc_cat=102&_nc_ohc=6DxWV89oy-gAX_6q6_R&oh=567d43994980aba46a49eb67ee3d7dbf&oe=5EE42E60,123,https://www.instagram.com/p/B4g2Y2YgZ_I,Wed Nov 06 13:05:16 WIB 2019,"The first decade of our playground 🥳-Terima kasih atas kepercayaan Mom dan si kecil untuk selalu setia memilih Miniapolis dari mulai tempat bermain, tempat si kecil malakukan spa hingga potong rambut. Yang sejalan dengan keinginan kami menjadi one stop kids activities.-Sebagai hadiah untuk pemegang kartu Member Miniapolis yang setia, dapatkan potongan 50% untuk: 1. Tiket bermain 2. Miniapolis Kids Club (untuk kelas selama 6 bulan)3. Paket treatment di Miniapolis Baby Spa by @momnjo (Min. 3mio)4. Potong rambut di Miniapolis Kids Salon by @kiddycuts 5. Paket perayaan ulang tahun (Min. 50 pax-weekend)6. Pembelian ready art di Miniapolis Art Spot (Tote bag)P.s. satu Kartu Member Berlaku untuk Satu anak di Hari yang Sama.-Periode promo berlangsung dari tanggal 11-17 November 2019. Catat tanggalnya ya Mom dan jangan lupa mampir ke Miniapolis untuk rayakan ulang tahun Miniapolis yang ke-10 Karena akan banyak promo hingga Desember nanti.-#miniapolis #miniapolisplayground #miniapolis10thanniversary"
4,0.28016322553139655%,https://instagram.fcgk18-1.fna.fbcdn.net/v/t51.2885-15/e35/71348820_492367334688740_3244497019533546538_n.jpg?_nc_ht=instagram.fcgk18-1.fna.fbcdn.net&_nc_cat=108&_nc_ohc=VRawI9XC-0gAX8eOJTZ&oh=393ed009e23a96c64dde763f7e8c6e89&oe=5EE24555,42,https://www.instagram.com/p/B4TqTjOA6JI,Fri Nov 01 10:09:33 WIB 2019,"HAPPY FRIDAY 🐰-Setelah halloween kemarin, Miniapolis masih punya keseruan di Bandung. Yuk kumpul lagi Mom di acara Miniapolis Holiday Bazaar dan daftar untuk:1. Lomba Mewarnai2. Lomba Fashion Show3. Cooking class w/ @mamage_kitchen Info dan pendaftaran:0857 7721 0002-#miniapolis #miniapolisplayground #bazaarbandung #bandung #lombamewarnai #fashionshow #cookingclass"
2,0.49333089713137224%,https://instagram.fcgk18-1.fna.fbcdn.net/v/t51.2885-15/e35/s1080x1080/71760836_120172919110029_2587187751643980645_n.jpg?_nc_ht=instagram.fcgk18-1.fna.fbcdn.net&_nc_cat=109&_nc_ohc=ML9eLD5FYqkAX_fNE6b&oh=00291144a69cb0910488b1384a15fd09&oe=5EE0E182,79,https://www.instagram.com/p/B4Ma7HXgg4j,Tue Oct 29 14:40:28 WIB 2019,"It's a wrap! Selesai sudah perayaan Miniapolis Halloween Party tahun ini. Bagaimana Mom tanggapannya untuk couple costume atau Miniapolis Halloween tahun ini? Senang sekali Miniapolis bisa menjadi tempat bermain yang juga memberikan hiburan lebih untuk si kecil. Semoga semua happy ya Mom, sampai bertemu di Event lainnya 🐰-#miniapolis #miniapolisplayground #miniapolishalloweenparty"
0,0.23752969121140144%,https://instagram.fcgk18-1.fna.fbcdn.net/v/t51.2885-15/e35/71970631_421451965234628_5028551161742438940_n.jpg?_nc_ht=instagram.fcgk18-1.fna.fbcdn.net&_nc_cat=108&_nc_ohc=L8mzBoWvZWQAX8zIFcJ&oh=3636d6ba23551617549eed493294bdfc&oe=5EE09739,39,https://www.instagram.com/p/B4Bru4kAeRE,Fri Oct 25 10:35:42 WIB 2019,"Miniapolis Halloween Bazaar 🎃-Hi Moms, sebelum Halloween Party hari ini sampai Minggu di Miniapolis Plaza Indonesia tersedia bazaar kids and baby juga lho. Jangan lupa mampir ya, karena di sepanjang koridor Miniapolis Plaza Indonesia Lt.3 tersedia kebutuhan Mom dan si kecil yang tidak kalah menarik untuk dibawa pulang. Psst.. jangan ketinggalan promonya ya Mom 🐰-#miniapolis #miniapolisplayground #miniapolishalloweenbazaar"
1,0.37152079907424324%,https://instagram.fcgk18-1.fna.fbcdn.net/v/t51.2885-15/e35/75349246_141323943882308_3836781764046169813_n.jpg?_nc_ht=instagram.fcgk18-1.fna.fbcdn.net&_nc_cat=108&_nc_ohc=k4sH-yPHqx4AX_wPt8a&oh=a7243f763d5d2605e984fd85481c40c7&oe=5EE0A20D,60,https://www.instagram.com/p/B4BI_cYACd4,Fri Oct 25 05:32:07 WIB 2019,"Who's ready for tomorrow?-Pekan terakhir untuk berkesempatan ikuti keseruan Miniapolis Halloween Party tahun ini di Jakarta dan Bandung. Jangan lewatkan acara dan hadiah kami tahun ini, karena khusus tahun ini kami ingin mengajak Mom dan si kecil ber Kreatifitas bersama dengan couple costume competition. Sampai bertemu besok di Miniapolis Plaza Indonesia Jakarta dan Miniapolis 23 Paskal Bandung pukul 14.00.-Info dan pendaftaran: ‪ ‪0815 1721 8566‬-#miniapolis #miniapolisplayground #miniapolishalloweenparty"
4,0.3532492843656739%,https://instagram.fcgk18-2.fna.fbcdn.net/v/t51.2885-15/e35/74900062_2568421406571708_5886390663310846810_n.jpg?_nc_ht=instagram.fcgk18-2.fna.fbcdn.net&_nc_cat=100&_nc_ohc=jSEYcKaLG7EAX9ONqod&oh=8187eca9d41ca3279c0679f9484d0454&oe=5EE41AA6,54,https://www.instagram.com/p/B39pnHfA-cb,Wed Oct 23 21:00:12 WIB 2019,"Kesempatan terakhir bagi yang belum ikuti keseruan Miniapolis Halloween Party tahun ini. Yuk Moms ajak si kecil Sabtu dan Minggu ini ke Miniapolis Plaza Indonesia (Jakarta) dan Miniapolis 23 Paskal (Bandung) untuk coba sendiri keseruan dan hadiah yang didapatkan. Jangan lupa untuk datang dengan kostum couple dengan si kecil ya Mom, siapa tahu, Mom pemenang kostum Halloween Party Miniapolis tahun ini 🐰🎃-RSVP: 0815 1721 8566#miniapolis #miniapolisplayground #miniapolishalloweenparty"
1,0.231439186308545%,https://instagram.fcgk18-1.fna.fbcdn.net/v/t51.2885-15/e35/72640659_3052521454818621_5694428792285020314_n.jpg?_nc_ht=instagram.fcgk18-1.fna.fbcdn.net&_nc_cat=109&_nc_ohc=UCjIk11yJ3YAX8aoBz0&oh=eb9bbdae7cd35288e814eb893210eb14&oe=5EE2FF75,37,https://www.instagram.com/p/B36uFeKgboL,Tue Oct 22 17:41:34 WIB 2019,"Ditemani mommy atau daddy ke Miniapolis Halloween Party akan sama-sama seru lho. Karena rangkaian aktivitasnya telah kami sesuaikan untuk anak dan orang tua melakukan bonding time.-Bagi Mom yang belum ajak si kecil ke Miniapolis Halloween Party tahun ini, jangan khawatir karena minggu ini masih tersedia di Miniapolis Plaza Indonesia Jakarta dan Miniapolis 23 Paskal Bandung 26-27 Okt '19.Info dan registrasi: 0815 1721 8566#miniapolis #miniapolisplayground #miniapolishalloweenparty"
1,0.3167062549485352%,https://instagram.fcgk18-1.fna.fbcdn.net/v/t51.2885-15/e35/71180301_543889276364837_2506352994011385045_n.jpg?_nc_ht=instagram.fcgk18-1.fna.fbcdn.net&_nc_cat=105&_nc_ohc=VmoyTmNi2JAAX_7uVHC&oh=3ba50e169f8562a90539c9be103bc38c&oe=5EE38694,51,https://www.instagram.com/p/B3wLU5jAw5O,Fri Oct 18 15:25:26 WIB 2019,"See You Tomorrow! 🎃Dimulai dari cabang Miniapolis Lippo Mall Puri, Aeon Mall BSD City dan Pakuwon Mall Surabaya, yuk kenakan kostum terunik di perayaan Miniapolis Halloween Party tahun ini! Jangan lewatkan perayaan halloween si kecil di Miniapolis besok pukul 14.00 WIB. RSVP: 0815 1721 8566#miniapolis #miniapolisplayground #miniapolishalloweenparty"
5,0.41415433339423835%,https://instagram.fcgk18-2.fna.fbcdn.net/v/t51.2885-15/e35/71509200_491629634759020_1813659095470030647_n.jpg?_nc_ht=instagram.fcgk18-2.fna.fbcdn.net&_nc_cat=104&_nc_ohc=cMYVEz_fqi4AX-qXx2b&oh=3b146152f6440bea56a2ce2c8eb59c99&oe=5EE13199,63,https://www.instagram.com/p/B3uRY2_gvFi,Thu Oct 17 21:39:56 WIB 2019,"Hi Mom, khusus tahun ini ada couple costume competition di perayaan #miniapolishalloweenparty, jadi jangan lupa untuk datang ke Miniapolis dengan kostum yang sudah matching atau mungkin kembar dengan si kecil. Sampai bertemu Hari Sabtu di cabang Miniapolis Lippo Mall Puri, Aeon Mall BSD City dan Pakuwon Mall Surabaya ya Mom.#miniapolis #miniapolisplayground #halloweenforkids #halloweenparty -Info dan pendaftaran Miniapolis Halloween: ‪0815 1721 8566‬"
18,0.41415433339423835%,https://instagram.fcgk18-2.fna.fbcdn.net/v/t51.2885-15/e35/67815207_474193116766270_5875978060895439547_n.jpg?_nc_ht=instagram.fcgk18-2.fna.fbcdn.net&_nc_cat=110&_nc_ohc=41Fw0FfD89oAX9zGhfv&oh=aebd8f5872e66fbdb80b8a5697deb9f4&oe=5EE05E70,50,https://www.instagram.com/p/B2V45_IAvcg,Fri Sep 13 13:52:50 WIB 2019,"Miniapolis birthday promo of the month!-Dapatkan berbagai keuntungan untuk si kecil dan teman-temannya di Hari Ulang tahunnya nanti. Pastikan sudah menjadi member Miniapolis ya Mom karena promo ini diberikan khusus bagi pemilik kartu Member Moniapolis yang masih aktif.-Swipe left untuk dapatkan kontak informasi diskon dan kontak di setiap cabang Miniapolis 🐰-#miniapolis #miniapolisplayground #birthdayparty #kidsbirthdayparty"
9,0.4446068579085206%,https://instagram.fcgk18-2.fna.fbcdn.net/v/t51.2885-15/e35/68695989_1488940721271780_1564181622551320844_n.jpg?_nc_ht=instagram.fcgk18-2.fna.fbcdn.net&_nc_cat=100&_nc_ohc=ujZP9BHK_7wAX_AHyft&oh=f44f4619623ec637f7f977a6b61b389f&oe=5EE0E126,64,https://www.instagram.com/p/B2Q6utzAoXN,Wed Sep 11 15:32:34 WIB 2019,"Spotted @luna.allegra @lihatlilou @pippaseespink having fun together at Miniapolis Plaza Indonesia. These girls are so cute and funny! Can't wait to see you guys again 🐰-#miniapolis #miniapolisplayground #miniapolisplazaindonesia"
1,0.2618917108228272%,https://instagram.fcgk18-2.fna.fbcdn.net/v/t51.2885-15/e35/s1080x1080/69704457_141935400387031_3096069630756285923_n.jpg?_nc_ht=instagram.fcgk18-2.fna.fbcdn.net&_nc_cat=107&_nc_ohc=SqHIyReYEC8AX-CyFMu&oh=17bf76c8aa9a5231a956a0ecbbef2bff&oe=5EE23CA9,42,https://www.instagram.com/p/B2ItIsPgeAU,Sun Sep 08 10:59:51 WIB 2019,"Sunday - Miniapolis - playing - spa - relax - repeat.-Miniapolis Baby Spa by Mom n Jo, available at:1. Miniapolis Plaza Indonesia (JKT)2. Miniapolis Lippo Mall Puri (JKT)3. Miniapolis 23 Paskal (BDG)4. Miniapolis Pakuwon Mall (SBY) #sundayfunday #miniapolis #miniapolisbabyspabymomnjo #momnjo #babyspa"
0,0.49942140203422863%,https://instagram.fcgk18-1.fna.fbcdn.net/v/t51.2885-15/e35/68947365_2325781854341709_5302247914969142662_n.jpg?_nc_ht=instagram.fcgk18-1.fna.fbcdn.net&_nc_cat=109&_nc_ohc=HPONl1prkwYAX_FuhNV&oh=1847b9a8615225f502099850d4a8b7ac&oe=5EE2079F,82,https://www.instagram.com/p/B1-YI4mgpNU,Wed Sep 04 10:43:59 WIB 2019,"Selamat Hari Pelanggan Nasional 🐰-Senang sekali rasanya untuk selalu bisa menyambut Mom dan anak-anak Mom datang ke Miniapolis. Menyapa dari meja transaksi, pintu gerbang, memakaikan gelang, hingga bermain bersama di area. Banyak hal yang kami pelajari dan dapatkan dari pelanggan setia kami selama ini. Semoga kami bisa terus melayani Mom dan si kecil di Miniapolis, karena kami percaya bahwa kami telah berada di jalan yang benar, saat menempatkan pelanggan kami sebagai prioritas utama di setiap kesempatan.-We 🐰 You,Dari kami, tim Miniapolis.#miniapolis #miniapolisplayground #haripelanggannasional"
0,0.21925817650283208%,https://instagram.fcgk18-1.fna.fbcdn.net/v/t51.2885-15/e35/s1080x1080/67383730_2359421164374131_1281615604736853850_n.jpg?_nc_ht=instagram.fcgk18-1.fna.fbcdn.net&_nc_cat=111&_nc_ohc=RNV_O2udVRoAX-sp_VE&oh=46ab7237b953c412cef423dcbd17023e&oe=5EE204E8,36,https://www.instagram.com/p/B1qo3n-AYgS,Tue Aug 27 18:45:21 WIB 2019,"Hi Moms, sudah ajak si kecil bermain dengan balance bike (kick bike) atau sepeda tanpa pedal?-Miniapolis menggandeng @londontaxi_kids dalam menyediakan balance bike bagi si kecil yang tersedia di Miniapolis Plaza Indonesia, Aeon Mall BSD City dan Pakuwon Mall Surabaya.-Yuk ajak si kecil melatih keseimbangan sejak dini sambil bermain di Miniapolis 🐰-#miniapolis #miniapolisplayground #balancebike #londontaxibikekids"
2,0.29234423533710946%,https://instagram.fcgk18-2.fna.fbcdn.net/v/t51.2885-15/e35/68706887_1297218623787511_3291605678804458359_n.jpg?_nc_ht=instagram.fcgk18-2.fna.fbcdn.net&_nc_cat=107&_nc_ohc=YMbFinCkkuUAX-aAn0W&oh=549d23be6043bb69b3ea917861dc9c2a&oe=5EE072DD,46,https://www.instagram.com/p/B1lBTptAEzJ,Sun Aug 25 14:23:27 WIB 2019,"Hello Sunday!-Hai Moms, yang hari ini main ke Miniapolis, tag dan mention kami yuk Moms 🐰-Lokasi foto: Miniapolis Plaza Indonesia#miniapolis #miniapolisplayground #miniapolisplazaindonesia"
6,0.341068274559961%,https://instagram.fcgk18-1.fna.fbcdn.net/v/t51.2885-15/e35/s1080x1080/69381023_343171719901547_5127005692062178362_n.jpg?_nc_ht=instagram.fcgk18-1.fna.fbcdn.net&_nc_cat=111&_nc_ohc=9f35X0IBCnMAX8u6SEi&oh=a49c002e1b77b12a2f7353a76c0a1cd4&oe=5EE0F6BE,50,https://www.instagram.com/p/B1dihOAAvVX,Thu Aug 22 16:39:44 WIB 2019,"#miniapolissafeforbaby -Di Miniapolis tersedia Baby Area yang aman untuk si kecil merangkak, belajar berjalan, mengenali bentuk hingga mini ball pool. Yuk ajak si kecil main lagi minggu ini, Mom 🐰-#miniapolis #miniapolisplayground #babyplayground"
4,0.36543029417138684%,https://instagram.fcgk18-1.fna.fbcdn.net/v/t51.2885-15/e35/s1080x1080/66665676_668831656927389_4496592128355400878_n.jpg?_nc_ht=instagram.fcgk18-1.fna.fbcdn.net&_nc_cat=109&_nc_ohc=uBa1FOshjZ4AX-egwdk&oh=0160ecac53ce5baf1e48708eb28326aa&oe=5EE2F2B7,56,https://www.instagram.com/p/B042tuHAOr4,Thu Aug 08 10:44:19 WIB 2019,"Miniapolis Kids Salon by @kiddycuts -Holla Mommy, pasti sudah sering ajak si kecil ke Kiddy Cuts untuk jadi pilihan potong rambut, kan? Di Miniapolis, untuk menambah kebutuhan si kecil, selain playground, tersedia kids salon juga lho Mom dan kami bekerjasama dengan Kiddy Cuts untuk hadirkan salon ramah anak dan hair styling yang akan membuat si kecil tampil lebih fresh dengan rambut barunya setelah atau sebelum bermain.Miniapolis Kids Salon by Kiddy Cuts, tersedia di:1. Miniapolis Plaza Indonesia (JKT)2. Miniapolis 23 Paskal (BDG)3. Miniapolis Pakuwon Mall (SBY)#Miniapolis #miniapolisayground #miniapoliskidssalonbykiddycuts #kidssalon #kiddycuts"
0,0.24362019611425786%,https://instagram.fcgk18-1.fna.fbcdn.net/v/t51.2885-15/e35/67309844_216116809371805_3776232349348733015_n.jpg?_nc_ht=instagram.fcgk18-1.fna.fbcdn.net&_nc_cat=101&_nc_ohc=3qeATjBFrQUAX9NzesW&oh=fb5bdebefe6db1a2346becccce9e43f1&oe=5EE36012,40,https://www.instagram.com/p/B0xTpfZAafy,Mon Aug 05 12:23:13 WIB 2019,"Monday Funday!Selalu ada alasan untuk kembali ke Miniapolis dan bermain bersama si kecil di kolam bola Miniapolis 🧸#Miniapolis #Miniapolisplayground #playground #ballpool #miniapolisplazaindonesia"
1,0.37152079907424324%,https://instagram.fcgk18-2.fna.fbcdn.net/v/t51.2885-15/e35/s1080x1080/66643369_124243135209494_372947480851958601_n.jpg?_nc_ht=instagram.fcgk18-2.fna.fbcdn.net&_nc_cat=102&_nc_ohc=i1tevMhFjIEAX8iqiLb&oh=ff92898111d2ecd39a3acc51821b1eb8&oe=5EE435DB,60,https://www.instagram.com/p/B0doHVXA88W,Sun Jul 28 20:57:15 WIB 2019,"Another sneak peek of this weekend at Miniapolis Plaza Indonesia. It'll always be our pleasure to keep you guys happy,  make a friend and enjoy the playground. Once again, Happy National Children's Day dear all Indonesian kids. I🐰U #AkuAnakIndonesia #Miniapolis #MiniapolisPlayground #MiniapolisPlazaIndonesia"
1,0.4567878677142335%,https://instagram.fcgk18-1.fna.fbcdn.net/v/t51.2885-15/e35/67307080_659293181259447_8373076683974894469_n.jpg?_nc_ht=instagram.fcgk18-1.fna.fbcdn.net&_nc_cat=103&_nc_ohc=I7w7YtxzAUwAX8iuwTA&oh=ed849755fce6e57be0ec3719cc329dae&oe=5EE2E632,74,https://www.instagram.com/p/B0blcDXg3O0,Sun Jul 28 01:55:23 WIB 2019,"A little sweet treat at Miniapolis Plaza Indonesia! 🍭Selain bermain dengan balloon, salah satu rangkaian dari perayaan Hari Anak Nasional 2019, Miniapolis hari ini berbagi cotton candy kepada adik-adik yang bermain, orang tua hingga orang-orang yang berjasa menjaga Miniapolis tetap aman. #bringingsmilestoeveryone bersama Miniapolis, yuk kita sebarkan kebahagiaan dan berbagi cita dengan orang terdekat🐰 -#AkuAnakIndonesia #Miniapolis #Miniapolisplayground #HariAnakNasional2019"
2,0.6212315000913576%,https://instagram.fcgk18-2.fna.fbcdn.net/v/t51.2885-15/e35/67171406_480882695810035_1622981589124294502_n.jpg?_nc_ht=instagram.fcgk18-2.fna.fbcdn.net&_nc_cat=107&_nc_ohc=7r1sHhW5BBcAX_k6Or-&oh=547633026e347997b10a0f5a559e1e27&oe=5EE2288D,100,https://www.instagram.com/p/B0YbpCDANjB,Fri Jul 26 20:32:03 WIB 2019,"#AkuAnakIndonesia 🇮🇩 Yuk rayakan Hari Anak Nasional bersama si kecil dan teman-temannya di Miniapolis akhir pekan ini.Khusus di Miniapolis Plaza Indonesia, ajak si kecil bermain dengan balloon warna-warni dan dapatkan Free cotton candy untuk setiap pembelian All Day Pass Sabtu 27 Juli 2019* *selama persediaan masih ada"
0,0.3897923137828126%,https://instagram.fcgk18-1.fna.fbcdn.net/v/t51.2885-15/e35/66462236_478873605992804_474985345701661395_n.jpg?_nc_ht=instagram.fcgk18-1.fna.fbcdn.net&_nc_cat=108&_nc_ohc=9-jowTbDoLsAX99OSzM&oh=1f382f228951087d57315a5c5490cc69&oe=5EE04C2E,64,https://www.instagram.com/p/B0PcgL9Af5s,Tue Jul 23 08:46:25 WIB 2019,"Hip hip horraay!! 🥳Selamat Hari Anak untuk seluruh Anak Indonesia. Yuk Moms terus wujudkan dan pertahankan Hak si kecil atas bermain, pendidikan, perlindungan hingga memiliki peran dalam pembangunan. Sementara itu, bimbing kami terus untuk menjadi Anak kebanggaan Mommy dan Daddy ya 🐰P.s. Rayakan Hari Anak Nasional bersama Hari Sabtu, 27 Juli 2019 di Miniapolis Plaza Indonesia dan dapatkan free Cotton Candy**by redeem All Day Pass Ticket 27 Juli 2019.#miniapolis #miniapolisplayground #harianaknasional2019"
0,0.2618917108228272%,https://instagram.fcgk18-2.fna.fbcdn.net/v/t51.2885-15/e35/65770696_158160105309883_4745636104371100288_n.jpg?_nc_ht=instagram.fcgk18-2.fna.fbcdn.net&_nc_cat=107&_nc_ohc=w4KiqNJDJ30AX_RDxHI&oh=3103db9cc7bc9e017d1b6ae5ca9160e0&oe=5EE3DB34,43,https://www.instagram.com/p/Bz9xhJdAbhH,Tue Jul 16 12:03:43 WIB 2019,"Miniapolis Summer Holiday belum berakhir! 🏖-Mom dan si kecil yang mampir ke Miniapolis Plaza Indonesia bisa menikmati permainan tambahan yang tersedia di area Hideout. Ajak si kecil mengumpulkan poin dan ambil gift dari Miniapolis.-Miniapolis Summer Holiday masih tersedia 2 minggu lagi ya Mom, jangan lewatkan keseruannya🐰-#miniapolis #miniapolisplayground #miniapolissummerholiday #summerholiday #miniapolisplazaindonesia"
2,0.18271514708569342%,https://instagram.fcgk18-2.fna.fbcdn.net/v/t51.2885-15/e35/66863153_356956098322798_1852926949667029860_n.jpg?_nc_ht=instagram.fcgk18-2.fna.fbcdn.net&_nc_cat=110&_nc_ohc=OZ3sDdJK7IMAX9iZ-i6&oh=81767b3082f9e9d9f5d79a729eb01500&oe=5EE18333,28,https://www.instagram.com/p/Bz4kZtcgoGE,Sun Jul 14 11:32:54 WIB 2019,"Sunday Spa-Day! 🧸-Sebagai one stop kids activities, Miniapolis juga menyediakan Baby Spa by @momnjo untuk membuat si kecil tetap relax dan nyaman dengan tubuhnya.-Miniapolis Baby Spa tersedia di:Plaza Indonesia: 0811 8080 207 (JKT)Lippo Mall Puri: 0811 1710 205 (JKT)23 Paskal: 0818 09107 042 (BDG)Pakuwon Mall : 0811 8080 209 (SBY)-#miniapolis #miniapolisplayground #miniapolisbabyspa #miniapolisbabyspabymomnjo #babyspa #babyspajakarta #babyspabandung #babyspasurabaya #momnjo"
