Comments,Engagement rate,Image,Likes,Url,Date,Caption
0,0.1948961568914063%,https://instagram.fcgk18-2.fna.fbcdn.net/v/t51.2885-15/e35/s1080x1080/96580357_560687714832244_1412813238720045978_n.jpg?_nc_ht=instagram.fcgk18-2.fna.fbcdn.net&_nc_cat=104&_nc_ohc=y9ZmL0uTITIAX_1OXWK&oh=a5a8afd0c873bf6aae465636342d5d09&oe=5EE1DA24,32,https://www.instagram.com/p/B__Ue-JgQCw,Sun May 10 08:45:13 WIB 2020,"It’s Sunday, It’s Sunny day and It’s Mother’s DayWhat is your favorite me-time mom?and remember that selfcare is not selfishHappy International Mother’s Day 💝🐰 #miniapolis #miniapolisplayground #happyinternationalmothersday #bringingsmilestoeveryone #mommetine"
0,0.231439186308545%,https://instagram.fcgk18-1.fna.fbcdn.net/v/t51.2885-15/e35/s1080x1080/95955027_568893680498819_3416946031951983417_n.jpg?_nc_ht=instagram.fcgk18-1.fna.fbcdn.net&_nc_cat=111&_nc_ohc=i7wamo0jrKMAX_mT0ZN&oh=55d3db62ca65a4a15dfddcfbea0528c1&oe=5EE08D4B,38,https://www.instagram.com/p/B_6XkO3gpd-,Fri May 08 10:35:57 WIB 2020,"Menjaga kesehatan di masa seperti ini memang satu hal yang wajib banget ya moms.Biasanya, si kecil demam atau batuk, bisa langsung dibawa ke dokter buat konsultasi. Tapi sekarang, mikir ratusan kali kalau harus bawa anak ke Rumah Sakit.So, biar kondisi anak bisa tetap fit atau moms jangan langsung panik kalau anak demam. Apa aja sih yang harus dilakukan?  Dann  mana yang mitos atau fakta?Miniapolis instagram live barengan sama dokter anak @distyayu di hari Selasa, 12 Mei 2020 jam 4 sore. Catat tanggalnya ya moms dan silahkan siapkan pertanyaan atau apa yang mengganjal selama ini seputar kesehatan anak. Miniapolis akan buka sesi pertanyaan, boleh di kolom komentar dan boleh juga di DM.Jangan sampe ketinggalan ya moms, dan ditunggu pertanyaannya 🐰#miniapolis #miniapolisplaygrond #bringingsmilestoeveryone #IGlive #momandkids"
0,0.1583531274742676%,https://instagram.fcgk18-2.fna.fbcdn.net/v/t51.2885-15/e35/s1080x1080/96083213_244242690025272_798348575210466434_n.jpg?_nc_ht=instagram.fcgk18-2.fna.fbcdn.net&_nc_cat=100&_nc_ohc=CaJTokhv9CMAX8bA7DU&oh=449b113d3aa18c1e2071cf9b778f6f4a&oe=5EE2BA95,26,https://www.instagram.com/p/B_3zmLtgW6Y,Thu May 07 10:43:10 WIB 2020,"-Science tells us that brains, minds are built not born- #miniapolis #miniapolisplayground #miniapoliskidsclub #bringingsmilestoeveryone #kidsactivity"
0,0.2253486814056885%,https://instagram.fcgk18-1.fna.fbcdn.net/v/t51.2885-15/e35/95626532_3787806554594207_2934559866240278475_n.jpg?_nc_ht=instagram.fcgk18-1.fna.fbcdn.net&_nc_cat=111&_nc_ohc=KbDbT4qlQDAAX-W7tAL&oh=98f9eb4d76a148469bc2f6b025209321&oe=5EE1827A,37,https://www.instagram.com/p/B_1WxQlDy9n,Wed May 06 11:52:47 WIB 2020,"Hi moms,Udah pernah masak bareng si kecil belum selama #dirumahaja? Kalau sudah pernah, apa sih yang paling menyenangkan dari kegiatan masak bareng si kecil? 🍩🍨🐰 #miniapolis #miniapolisplayground #kidsactivity #bringingsmilestoeveryo e"
43,1.2850965345027103%,https://instagram.fcgk18-1.fna.fbcdn.net/v/t51.2885-15/e35/95316088_153648586138713_7087046819026450684_n.jpg?_nc_ht=instagram.fcgk18-1.fna.fbcdn.net&_nc_cat=109&_nc_ohc=03hd2s73AB4AX857Dan&oh=489c6dfb0fe54994551f2a1b70d24ad5&oe=5EE2F0BF,168,https://www.instagram.com/p/B_v3pW8DixL,Mon May 04 08:44:37 WIB 2020,"Hi moms and kids,Yes, we miss you.Miss your laugh, miss your voice, miss your smileDan banyaakk lagi yang kami rindukan.Miniapolis juga mau mengajak moms dan si kecil buat mengingat kembali, apa aja hal yang membuat moms dan si kecil rindu dengan Miniapolis. Ada boneka Cricks yang akan diberikan kepada 3 moms beruntung, untuk menemani dan mengobati rindu si kecil. Caranya: 1. Follow @miniapolisplayground2. Like postingan di atas3. Sebutkan hal yang paling dirindukan dari Miniapolis dan sebutkan cabangnya4. Mention 3 orang teman yang pernah main bersama atau ingin diajak bermain nantinya ke Miniapolis5. Account jangan di private ya moms3 orang yang beruntung akan kami umumkan hari Sabtu, 9 May 2020 di instastory @miniapolisplayground Thank you moms 🐰 #miniapolis #miniapolisplayground #wemissyou #giveaway #kidsactivity"
0,0.16444363237712406%,https://instagram.fcgk18-2.fna.fbcdn.net/v/t51.2885-15/e35/s1080x1080/95264635_138095581142934_1419036441328694866_n.jpg?_nc_ht=instagram.fcgk18-2.fna.fbcdn.net&_nc_cat=106&_nc_ohc=iCd-XhbQiY0AX_oRUyq&oh=cf3913a26d9625fd2780f267550a65c9&oe=5EE36D6C,27,https://www.instagram.com/p/B_uBwBVD1Mw,Sun May 03 15:34:26 WIB 2020,"Hello, Restock Crick’s Kits Shapes seriesTerima kasih yang sudah memesan dan bermain Crick’s Kits “Let’s learn about shapes” Ada 5 jenis permainan untuk mengenal bentuk dan sudah termasuk spidol, playdoh, shoe lace, wooden peg juga instruksi cara bermain. Buat yang belum kebagian, Miniapolis kembali membuat Shapes series ini lho. Selain ada 5 jenis kartu untuk mengenal bentuk yang bisa dimainkan sesuai instruksi, kartu ini bisa dimainkan dengan beberapa cara lagi, misalnya dikelompokkan sesuai warna, sesuai bentuk dan playdoh juga bisa dimainkan dengan kreasi lainnya.  Info dan pembelian: 0811 1573 743Jangan lupa share video atau foto sambil bermaim Crick’s Kits yaa moms. Dan tunggu kejutan Crick’s Kit selanjutnya 🐰❤️ miniapolis #miniapolisplayground #crickskits #earlysciencelearning #kidsactivity"
0,0.231439186308545%,https://instagram.fcgk18-2.fna.fbcdn.net/v/t51.2885-15/e35/s1080x1080/95259260_118274123196558_7343553305104703839_n.jpg?_nc_ht=instagram.fcgk18-2.fna.fbcdn.net&_nc_cat=106&_nc_ohc=evYStBEQcYAAX9Cv1ic&oh=28bc96650fc21114ced372ea817398dc&oe=5EE206D2,38,https://www.instagram.com/p/B_trCLej3Dk,Sun May 03 12:15:56 WIB 2020,"Saat #dirumahaja tentunya jadi banyak waktu untuk bermain dengan si kecil ya moms. Kegiatan di sekolah memang terhenti, dan berganti menjadi #dirumahaja. Tidak belajar di sekolah, bukan berarti berhenti belajar. Kegiatan berdua dengan si kecil yang paling menyenangkan selama #dirumahaja versi moms apa nih? 🐰 Share ke kita yuk moms, siapa tau ada yang bisa kasih ide dan terinspirasi untuk mengisi waktu di rumah bersama si kecil, supaya tidak bosan. #miniapolis #miniapolisplayground #boundingtimewithfamily #kidsactivity"
0,0.18880565198854984%,https://instagram.fcgk18-1.fna.fbcdn.net/v/t51.2885-15/e35/s1080x1080/95174683_133978781573757_3373546480005469768_n.jpg?_nc_ht=instagram.fcgk18-1.fna.fbcdn.net&_nc_cat=109&_nc_ohc=DQOGcld89ZoAX_vcTJe&oh=b09349b49899a87a75c2e1b80bca3059&oe=5EE1E810,31,https://www.instagram.com/p/B_oxFMwDpGt,Fri May 01 14:32:35 WIB 2020,"Dear Mom, Daddy, Aunty and Uncle, Semangat terus bekerja, terutama untuk semua yang berada di garda depan untuk memenuhi kebutuhan pokok demi kelangsungan perjalanan hidup menghadapi situasi ini.A sincere thank you to each one of you and We wish strength and better future for the hardworking workers in Indonesia 🇮🇩 Happy International Labour Day #miniapolis #miniapolisplayground #indonesiapeduli #mayday #internationallabourday #indonesiabersatu#bringingsmilestoeveryone"
0,0.21925817650283208%,https://instagram.fcgk18-1.fna.fbcdn.net/v/t51.2885-15/e35/p1080x1080/95371626_230428338394597_4618457983094373467_n.jpg?_nc_ht=instagram.fcgk18-1.fna.fbcdn.net&_nc_cat=101&_nc_ohc=s29aDNfATaAAX8zXq01&oh=19d08f6a4fe3c9b853ffaee1dedc7b8b&oe=5EE431F0,36,https://www.instagram.com/p/B_mEdvDDuja,Thu Apr 30 13:24:14 WIB 2020,"Hi Moms,Bagaimana kegiatan #dirumahaja dengan si kecil? Crick rindu sekali membuat kegiatan bersama di Miniapolis Tapi tentunya Miniapolis tetap ingin menjadi teman si kecil selama #dirumahaja. Saat ini ada Crick’s Kits untuk kegiatan motoric si kecil dengan menggunakan reusable cards.Tidak hanya itu, Miniapolis akan membuat Crick’s Kits seri lainnya untuk menemani si kecil di rumah. Stay tune and Stay safe Moms 🐰 #miniapolis #miniapolisplayground #crickskits #bringingsmilestoeveryone"
0,0.1948961568914063%,https://instagram.fcgk18-1.fna.fbcdn.net/v/t51.2885-15/e35/s1080x1080/94967576_1047942032259189_617055577591681747_n.jpg?_nc_ht=instagram.fcgk18-1.fna.fbcdn.net&_nc_cat=109&_nc_ohc=3xKwUTgzhhEAX-X5x79&oh=6e33cfb05aef21442baecadc9af5f314&oe=5EE298F2,32,https://www.instagram.com/p/B_bol0nDTZh,Sun Apr 26 12:08:16 WIB 2020,"A DAY AT HOME WITH YOUR LITTLE ONEHi Mom, Masih #dirumahaja dan dalam suasana bulan Ramadhan ini, tentunya sudah punya kegiatan rutin dengan si kecil ya moms. Sharing yuk moms, ada kegiatan unik atau berbeda apa yang sekarang moms lakukan dengan si kecil selama #dirumahaja? Atau sama dengan yang kita lakukan? Share di kolom comment ya moms 🐰#miniapolis #miniapolisplayground #bringingsmilestoeveryone #kidsactivity"
0,0.1583531274742676%,https://instagram.fcgk18-1.fna.fbcdn.net/v/t51.2885-15/e35/s1080x1080/94486468_223789642053639_5480563441258662582_n.jpg?_nc_ht=instagram.fcgk18-1.fna.fbcdn.net&_nc_cat=103&_nc_ohc=VsDgPwvyK_kAX_nwDqt&oh=c6f0121e4ca4bf6e6226d6e48818841f&oe=5EE22E14,26,https://www.instagram.com/p/B_WR2Y3Dd_n,Fri Apr 24 10:13:20 WIB 2020,"Selamat menunaikan ibadah puasa Ramadhan bagi Mom dan keluarga yang menjalankan.Semoga Ramadhan tahun ini membawa segala kebaikan, kasih sayang dan pengampunan bagi kita semua dari Tuhan sehingga ibadah kita bisa tetap lancar di tengah situasi ini. Stay safe ya Mom and please #stayhome 🐰-#miniapolis #miniapolisplayground #ramadhan1441h #miniapolisathome"
0,0.1948961568914063%,https://instagram.fcgk18-2.fna.fbcdn.net/v/t51.2885-15/e35/s1080x1080/94320558_912024392563912_7668592221289760304_n.jpg?_nc_ht=instagram.fcgk18-2.fna.fbcdn.net&_nc_cat=104&_nc_ohc=CfyntfEuqeYAX8MyLSC&oh=a022812003a1bde7653d1cf2cfcf2b3a&oe=5EE25332,32,https://www.instagram.com/p/B_OzGQcjQ3C,Tue Apr 21 12:29:57 WIB 2020,"Ibu Kita Kartini Pendekar Bangsa, Pendekar kaumnya untuk Merdeka.-Sebuah ucapan Selamat Hari Kartini yang kami tujukan kepada para perempuan medis Indonesia, yang sedang menjadi Kartini dalam perjuangannya sepenuh hati membuat Indonesia kembali pulih. Kalianlah pahlawan kami saat ini untuk kembali Indonesia merdeka dari ancaman COVID-19. Semoga Tuhan selalu melindungi para tenaga medis dan keluarga yang juga selalu diberikan kesehatan di mana pun berada. Tertanda,Miniapolis.-#miniapolis #miniapolisplayground #kartiniday #miniapolisathome #stayhome #dirumahaja #indonesiapeduli #indonesiabersatu"
0,0.3471587794628175%,https://instagram.fcgk18-2.fna.fbcdn.net/v/t51.2885-15/e35/93450354_2581412238793200_133290760064322064_n.jpg?_nc_ht=instagram.fcgk18-2.fna.fbcdn.net&_nc_cat=100&_nc_ohc=Pl650ENRiPUAX83JH-h&oh=c86ed1ef6a6e2377f8b9fabf8629810c&oe=5EE350BF,57,https://www.instagram.com/p/B-80FHCDzhA,Tue Apr 14 12:52:12 WIB 2020,"Sejak dulu kebersihan selalu menjadi bagian dari tanggung jawab Miniapolis atas kenyamanan Mom dan si kecil di area kami. Selama masa PSBB ini, Miniapolis tetap kami pastikan bersih hingga nanti kita bisa bertemu kembali dan tetap menjadi pilihan tempat bermain keluarga setelah pandemik ini selesai. Stay safe and stay home. Already miss You Mom and kiddos🐰-#miniapolis #miniapolisplayground"
0,0.21316767159997563%,https://instagram.fcgk18-2.fna.fbcdn.net/v/t51.2885-15/e35/s1080x1080/93166097_255542338908468_7180031509582166376_n.jpg?_nc_ht=instagram.fcgk18-2.fna.fbcdn.net&_nc_cat=100&_nc_ohc=dStR96wfw_4AX_ROuIH&oh=429a6f549f2646c882fd076a03733680&oe=5EE05A60,35,https://www.instagram.com/p/B-3UpyDDJLw,Sun Apr 12 09:41:23 WIB 2020,"Selamat Hari Paskah untuk Moms dan Keluarga yang Merayakan. Meski tahun ini terdapat beberapa perbedaan dengan perayaan sebelumnya, semoga cinta dan kedamain Tuhan serta Keluarga tetap selalu sama untuk kita rasakan ya Moms. #staysafe #stayhome #miniapolis #miniapolisplayground #happyeaster🐰"
5,0.2740727206285401%,https://instagram.fcgk18-1.fna.fbcdn.net/v/t51.2885-15/e35/s1080x1080/92790570_544934923072141_7256920881134031106_n.jpg?_nc_ht=instagram.fcgk18-1.fna.fbcdn.net&_nc_cat=101&_nc_ohc=JFHPQTaScUQAX9R-I1Z&oh=a3998c415c4ce3c99b44f9a52266b4c4&oe=5EE2B6A7,40,https://www.instagram.com/p/B-vudWyD1h9,Thu Apr 09 10:52:57 WIB 2020,"Hi Moms! Yuk ajak si kecil mengenal dan membuat bentuk dengan Crick’s Kits!-Agar tidak bosan dan tetap kreatif, Crick’s Kits telah kami sesuaikan untuk kebutuhan si kecil dalam meningkatkan keterampilan motorik halusnya untuk tetap produktif bersama Mom and Daddy di rumah. Tersedia unique 5 sets reusable cards yang dapat Mom dan si kecil mainkan bersama lho. Selain kartu dan perlengkapannya, tersedia beberapa ide permainan yang kami berikan juga di dalamnya untuk mix and match sesuai kebutuhan.-Slide ke kanan untuk melihat detailnya ya Moms-Info dan pembelian: 0811 1573 743#miniapolis #miniapolisplayground #miniapolisathome #homebasedlearning #learningkids"
1,0.28016322553139655%,https://instagram.fcgk18-2.fna.fbcdn.net/v/t51.2885-15/e35/s1080x1080/92068139_147943469980560_5921365071204607887_n.jpg?_nc_ht=instagram.fcgk18-2.fna.fbcdn.net&_nc_cat=100&_nc_ohc=XbQrYk3LKz8AX-w4JJb&oh=5d718a7868fa75e4bbe5e4e8d16009e1&oe=5EE40B92,45,https://www.instagram.com/p/B-tnsSqDyq1,Wed Apr 08 15:15:20 WIB 2020,"Hi Moms! Let’s Keep Your Kids Busy with Crick’s Kits!-Miniapolis kini menghadirkan Crick’s Kits yang berguna untuk meningkatkan keterampilan motorik halus si kecil selama #dirumahaja dengan mengenal dan membuat berbagai macam bentuk. Di dalam Crick’s Kits ini, tersedia 5 sets reusable cards yang dapat Mom dan si kecil mainkan bersama.-Info dan pemesanan: 0811 1573 743 #miniapolis #miniapolisplayground #miniapolisathome #homebasedlearning #learningkids"
8,0.4019733235885255%,https://instagram.fcgk18-2.fna.fbcdn.net/v/t51.2885-15/e35/s1080x1080/92281555_215530079681386_4084638984065503100_n.jpg?_nc_ht=instagram.fcgk18-2.fna.fbcdn.net&_nc_cat=110&_nc_ohc=imGfqEOPMMEAX-WkrkV&oh=bd0d3d4c518a5bd41be2e95774db37c2&oe=5EE20757,58,https://www.instagram.com/p/B-n5BwhjJEj,Mon Apr 06 09:51:23 WIB 2020,"Happy Monday 🌤-Apa saja nih Moms kegiatannya bersama si kecil selama #dirumahaja? Semoga keadaan ini, segera berlalu agar kita bisa berjumpa dan bermain bersama lagi di Miniapolis. Kira-kira apa nih yang paling Moms dan si kecil rindukan dari Miniapolis? Komen di bawah yuk...-#miniapolis #miniapolisplayground"
0,0.23752969121140144%,https://instagram.fcgk18-2.fna.fbcdn.net/v/t51.2885-15/e35/91410881_1780466665411168_3089580919910947360_n.jpg?_nc_ht=instagram.fcgk18-2.fna.fbcdn.net&_nc_cat=104&_nc_ohc=lEF8ZTzqvt8AX8Ofktt&oh=cbae26e25fca7c2071d69bd8c8542898&oe=5EE3E636,39,https://www.instagram.com/p/B-WhRZ6j88T,Mon Mar 30 15:56:42 WIB 2020,"Tetap #dirumahaja bersama si kecil untuk membuat #familybondingtime menjadi lebih erat dan menyenangkan. Kira-kira apa saja nih Mom, yang sudah Mom dan si kecil lakukan akhir-akhir ini saat berada di rumah bersama si kecil? Share di kolom komentar yuk untuk menginspirasi kegiatan seru ke mommy lainnya yang juga sedang #dirumahaja dulu 🐰-#miniapolis #miniapolisplayground"
0,0.20098666179426275%,https://instagram.fcgk18-2.fna.fbcdn.net/v/t51.2885-15/e35/s1080x1080/91080489_3090845340948820_4198339043639718566_n.jpg?_nc_ht=instagram.fcgk18-2.fna.fbcdn.net&_nc_cat=104&_nc_ohc=fEaFcarl1swAX-w6Ec3&oh=bf778a94d9d497ed4f5d8f478fe29d6f&oe=5EE11659,33,https://www.instagram.com/p/B-OMSnXjQhw,Fri Mar 27 10:19:27 WIB 2020,"Dear Moms,Sedih sekali untuk mengumumkan bahwa Miniapolis Easter Party 2020 ditiadakan. Terima kasih atas kepercayaan serta antusias Mom dan si kecil yang sudah excited menunggu acara Miniapolis Easter Party dari tahun ke tahun. Ini semua tentu dilakukan karena kami mencintai pelanggan kami dan dalam usaha kami mengikuti arahan yang berlaku demi sama-sama memerangi issue saat ini. In the meantime, sampai bertemu di Big Event Miniapolis yang akan datang selanjutnya di tahun ini ya, Stay safe Mom and kiddos! Can't wait to see you soon🐰-#miniapolis #miniapolisplayground"
0,0.17662464218283694%,https://instagram.fcgk18-2.fna.fbcdn.net/v/t51.2885-15/e35/91003895_552176038739092_1685138426982372379_n.jpg?_nc_ht=instagram.fcgk18-2.fna.fbcdn.net&_nc_cat=104&_nc_ohc=uoWJv3pZqFMAX-R8WVO&oh=36a677d1ef05f42b5bdecd5bc4d3dd5b&oe=5EE0C6EE,29,https://www.instagram.com/p/B-MCSnCDPHz,Thu Mar 26 14:13:35 WIB 2020,"Hi Moms, Salah satu cara untuk menjaga kesehatan si kecil adalah penggunaan essential oil. Berikut rekomendasi must have items essential oil, Belli to Baby versi Miniapolis Baby Spa by @momnjo: 1. Eucalyptus essential Oil (antivirus untuk menjaga saluran pernafasan dari bakteri)2. Cold n Fresh essential Oil (membantu meredakan flu dan batuk) 3. Lavender essential Oil (stress away, calming mind dan membantu tidur lebih nyenyak)4. Immune Booster Oil (mengandung vitamin C untuk meningkatkan daya tahan tubuh)-Belli to Baby kini sudah menerima pembelian online ke nomor:Plaza Indonesia: 0811 8080 207 (JKT)Lippo Mall Puri: 0811 1710 205 (JKT)23 Paskal: 0818 09107 042 (BDG)Pakuwon Mall : 0811 8080 209 (SBY)-#miniapolis #miniapolisplayground #miniapolisbabyspa #miniapolisbabyspabymomnjo #babyspa #babyspajakarta #babyspabandung #babyspasurabaya #momnjo"
0,0.21316767159997563%,https://instagram.fcgk18-1.fna.fbcdn.net/v/t51.2885-15/e35/90429114_145052470328948_2244336238266132619_n.jpg?_nc_ht=instagram.fcgk18-1.fna.fbcdn.net&_nc_cat=108&_nc_ohc=uBt-uJPR6AoAX-hlLBD&oh=5be97e788e8e9c002c20facdf69febdf&oe=5EE3D772,35,https://www.instagram.com/p/B-JkoWSgAs6,Wed Mar 25 15:15:56 WIB 2020,"Selamat Hari Raya Nyepi, Tahun Baru Saka 1942.-Agar kita dan si kecil tetap aman yuk #dirumahaja Moms, sekaligus sebagai wujud menghargai perayaan saudara-saudara kita yang merayakan Hari Nyepi ini 🐰Share yuk, apa saja yang Moms dan si kecil lakukan hari ini?-#miniapolis #miniapolisplayground #selamatharirayanyepi2020"
0,0.231439186308545%,https://instagram.fcgk18-2.fna.fbcdn.net/v/t51.2885-15/e35/s1080x1080/90990905_2256349611335458_6559651864403407376_n.jpg?_nc_ht=instagram.fcgk18-2.fna.fbcdn.net&_nc_cat=110&_nc_ohc=UGdVkNb_GtgAX-fZOYG&oh=1c70f4563abd828f56df11481fa606a7&oe=5EE2414C,38,https://www.instagram.com/p/B-JkNz9gE-l,Wed Mar 25 15:12:18 WIB 2020,"Dear Moms,Untuk sementara waktu, demi kebaikan kita bersama sesuai dengan arahan dari Pemerintah, berikut adalah jadwal 'temporary close' Miniapolis. In the meantime, please stay connect with us on instagram! See You soon dear Moms and Kiddos. Please stay at home and stay safe 🐰-#miniapolis #miniapolisplayground"
1,0.23752969121140144%,https://instagram.fcgk18-1.fna.fbcdn.net/v/t51.2885-15/e35/91289189_236363717503749_1179243885692654504_n.jpg?_nc_ht=instagram.fcgk18-1.fna.fbcdn.net&_nc_cat=109&_nc_ohc=23vi7z1qZ_UAX_rE-BI&oh=9e1dcb99631e58efaea844f81847dfcf&oe=5EE2A44D,38,https://www.instagram.com/p/B-G4GZdjd9e,Tue Mar 24 14:08:20 WIB 2020,"Hi Moms,Selain menjaga kebersihan tangan dan kaki, #dirumahaja jangan lupa untuk juga mengingatkan si kecil jaga kebersihan rambut. Creambath bareng si kecil juga bisa jadi salah satu cara quality time lho... In the meantime, Miniapolis Kids Salon by @kiddycuts can't wait to see you soon. Please stay safe and stay at home 🐰-#miniapolis #miniapolisplayground #miniapoliskidssalon #miniapoliskidssalonbykiddycuts #kiddycuts"
0,0.2558012059199708%,https://instagram.fcgk18-1.fna.fbcdn.net/v/t51.2885-15/e35/s1080x1080/90410985_1094403154228197_7920669872546614301_n.jpg?_nc_ht=instagram.fcgk18-1.fna.fbcdn.net&_nc_cat=109&_nc_ohc=go1R0TXzO_8AX-9dlwZ&oh=5a5f72b57e360c121f8b036420d5dc54&oe=5EE0DF33,42,https://www.instagram.com/p/B-Ba0fUD3MG,Sun Mar 22 11:16:17 WIB 2020,"Miniapolis Baby Spa on Call ☎️-Kini Miniapolis Baby Spa by @momnjo menyediakan layanan on call lho moms. Jadi meski #dirumahaja, Mom dan si kecil tetap dapat relax. Cukup menghubungi kami dan therapist kami akan datang untuk memberikan treatment kesukaan si kecil seperti saat sedang datang ke Miniapolis Baby Spa.-Mom dapat menghubungi kami di:Plaza Indonesia: 0811 8080 207 (JKT)Lippo Mall Puri: 0811 1710 205 (JKT)23 Paskal: 0818 09107 042 (BDG)-S&K berlaku.#miniapolis #miniapolisplayground #miniapolisbabyspa #miniapolisbabyspabymomnjo #babyspa #babyspajakarta #babyspabandung #babyspasurabaya #momnjo"
33,0.639503014799927%,https://instagram.fcgk18-1.fna.fbcdn.net/v/t51.2885-15/e35/s1080x1080/90791134_258671551815344_3033257865514449442_n.jpg?_nc_ht=instagram.fcgk18-1.fna.fbcdn.net&_nc_cat=108&_nc_ohc=JB6qlDKHIVMAX95l8X8&oh=4d8c355e9c81048f17bb057b78fab758&oe=5EE0D4FA,72,https://www.instagram.com/p/B985vNoAXlt,Fri Mar 20 17:10:14 WIB 2020,"Miniapolis Healthy Giveaway!-Hi Moms, dalam keadaan apa pun, kesehatan Moms dan keluarga tetap harus terjaga. Meningkatkan immune adalah salah satu cara untuk tetap vit di tengah aktivitas yang memadai. Tingginya kebutuhan multivitamin belakangan ini dan kepedulian kami terhadap pelanggan setia kami, Miniapolis kali ini bekerjasama dengan @youvitforlife ingin memberikan healthy package untuk Mom dan si kecil. Yuk simak caranya: 1.​ Follow @youvitforlife dan @miniapolisplayground 2.​ Like postingan ini dan tuliskan di kolom komentar apa saja cara Moms selama ini untuk tetap menjaga si kecil agar tetap sehat?3.​ Tag tiga sahabat Moms yang ingin Mom ingatkan juga untuk tetap menjaga kesehatan4.​ Pastikan akun Instagram tidak terkunci5. ​Pengumuman akan diinformasikan Rabu, 25 Maret 20206.​ Komentar paling menarik, akan mendapatkan healthy package dari YouVit dan Voucher bermain Miniapolis.-Good Luck and stay healthy! 🐰-#miniapolis #miniapolisplayground #miniapolisgivaway #miniapolisxyouvit #youvitforlife #1gummysetiaphari #dirumahaja #giveaway"
0,0.18880565198854984%,https://instagram.fcgk18-2.fna.fbcdn.net/v/t51.2885-15/e35/s1080x1080/90397621_143648046983518_6690701888931542779_n.jpg?_nc_ht=instagram.fcgk18-2.fna.fbcdn.net&_nc_cat=110&_nc_ohc=qrcbPu1gz-AAX-9GcHp&oh=a7152b18e7ebe708136fcac23b3ead22&oe=5EE19016,31,https://www.instagram.com/p/B95qPm8gfqV,Thu Mar 19 10:57:08 WIB 2020,"Yuk jaga kebersihan kaki.Selain menjaga kebersihan tangan, jangan lupa untuk juga menjaga kebersihan kaki. Sebagai taman bermain yang syarat akan penggunaan kaos kaki di area, demi kebersihan bersama yuk simak 3 hal dasar untuk menjaga kesehatan kaki pada si kecil.#miniapolis #miniapolisplayground"
0,0.24362019611425786%,https://instagram.fcgk18-2.fna.fbcdn.net/v/t51.2885-15/e35/90179836_344308926507338_7716487838615714940_n.jpg?_nc_ht=instagram.fcgk18-2.fna.fbcdn.net&_nc_cat=102&_nc_ohc=fVoQZZFzmZMAX9rcdxq&oh=d8bedac7fc6471d02bbe32d2dc0756f7&oe=5EE4227B,40,https://www.instagram.com/p/B94BL5vgXEh,Wed Mar 18 19:39:07 WIB 2020,"Kami Peduli.Kesehatan dan keselamatan bermain di area Miniapolis adalah hal yang selalu kami maksimalkan di setiap harinya. Termasuk membersihkan mainan-mainan agar terhindar dari sarang kuman. Jangan lupa untuk juga tetap menjaga mainan-mainan si kecil agar tetap bersih ya Mom, karena kepedulian untuk mereka bisa kita mulai dari hal yang paling dekat dengannya. -#miniapolis #miniapolisplayground"
0,0.2558012059199708%,https://instagram.fcgk18-1.fna.fbcdn.net/v/t51.2885-15/e35/90085929_517876555779435_4433598551507372622_n.jpg?_nc_ht=instagram.fcgk18-1.fna.fbcdn.net&_nc_cat=103&_nc_ohc=RKim_J2j_YgAX-hlkbR&oh=2e57d1a15e4f189fb648927cec986c1f&oe=5EE2E448,42,https://www.instagram.com/p/B9yTMYZg0Xq,Mon Mar 16 14:21:02 WIB 2020,"Hi Mom, hari ini tim tetap masuk kantor atau tim work from home?-Dengan informasi yang banyak beredar saat ini tentang kesehatan, semoga kita semua tetap aman. Jangan lupa untuk ajak si kecil tetap aktif dan produktif di masa liburnya ini ya Mom, mencuci tangan setiap usai beraktivitas, istirahat cukup dll. Karena sejatinya, si kecil hanya ingin bermain dengan mommy dan daddy tanpa tahu apa yang saat ini sedang terjadi. #staysafeeveryone #miniapolis #miniapolisplayground"
0,0.16444363237712406%,https://instagram.fcgk18-1.fna.fbcdn.net/v/t51.2885-15/e35/s1080x1080/89861904_1065870277144856_4906192540628231820_n.jpg?_nc_ht=instagram.fcgk18-1.fna.fbcdn.net&_nc_cat=108&_nc_ohc=6AqEVfzdeuYAX8BmCbt&oh=c3df5b8778068cc1880bb32a8c9b4986&oe=5EE229B8,27,https://www.instagram.com/p/B9k-T4kg0yo,Wed Mar 11 10:08:26 WIB 2020,"Tahukah kamu? Sekitar 98% penyebaran kuman di tubuh bersumber dari tangan kita sendiri. Sebelum dan sesudah bermain, Miniapolis menyediakan hand sanitizer di setiap gate playground kami. Tidak jauh dari area, juga tersedia kids toilet dari Mall agar si kecil bisa kembali mencuci tangan dengan sabun. Tetap ajak si kecil untuk selalu menjaga kebersihan yuk Mom, baik di dalam maupun di luar ruangan 🐰-#miniapolis #miniapolisplayground"
3,0.42024483829709486%,https://instagram.fcgk18-1.fna.fbcdn.net/v/t51.2885-15/e35/88278745_555920788359869_5335791531300937086_n.jpg?_nc_ht=instagram.fcgk18-1.fna.fbcdn.net&_nc_cat=105&_nc_ohc=yZPbWrPWKQYAX8N88lQ&oh=2721a834166e19a29df4a2a9ffd155cc&oe=5EE29CF9,66,https://www.instagram.com/p/B9gAo6tgRTI,Mon Mar 09 11:52:34 WIB 2020,"Hi Monday, Hi Mom 🐰-Selamat kembali menjalankan aktivitas. Jangan lupa untuk tetap menjaga kondisi badan ya Mom agar si kecil juga tetap sehat dan bisa terus aktif bermain. Di Miniapolis, kami juga selalu memberlakukan pengecekan suhu badan si kecil, baik untuk Playground maupun sebelum treatment di Miniapolis Baby Spa agar kami juga tetap bisa memastikan kalau mereka dalam suhu yang normal sebelum bereksplorasi di Miniapolis. Mom dan si kecil ada yang sudah pernah bertemu tim kami di gate untuk cek suhu juga? Mention ke kami yuk 🐰-#miniapolis #miniapolisplayground"
